순위,업소명,주소,분류,외지인 검색 수
1,드롭탑오송역언더패스점,충북 청주시 흥덕구,카페/찻집,18366
2,스타벅스청주오송점,충북 청주시 흥덕구 오송생명로 222-0,카페/찻집,11066
3,맥도날드청주비하DT점,충북 청주시 흥덕구 2순환로 1076-0,간이음식,9530
4,스타벅스청주봉명DT점,충북 청주시 흥덕구 1순환로 514-0,카페/찻집,8189
5,스타벅스청주비하DT점,충북 청주시 흥덕구 2순환로 1078-0,카페/찻집,7931
6,아웃백스테이크하우스청주점,충북 청주시 흥덕구 대농로 43-0,외국식,7833
7,맥도날드청주봉명DT점,충북 청주시 흥덕구 1순환로 518-0,간이음식,7271
8,본궁석갈비,충북 청주시 흥덕구 가포산로 197-0,한식,7098
9,삼학도수산,충북 청주시 흥덕구 비하로 30-0,외국식,6402
10,보국가든,충북 청주시 흥덕구 심동로 654-12,한식,6361
11,청주본가본점,충북 청주시 흥덕구 사운로 233-0,한식,6135
12,복남이네꽁당보리밥,충북 청주시 흥덕구 가포산로 191-0,한식,5924
13,듀레베이커리테크노점,충북 청주시 흥덕구 송화로150번길 21-0,간이음식,5747
14,유생촌청주점,충북 청주시 흥덕구 신성로 6-40,외국식,4821
15,스시히어로,충북 청주시 흥덕구 대농로 33-0,외국식,4332
16,경복궁청주점,충북 청주시 흥덕구 2순환로 1250-0,한식,3850
17,백송짜글짜글,충북 청주시 흥덕구 청주역로 635-0,한식,3696
18,파티올청주점,충북 청주시 흥덕구 풍년로142번길 29-0,외국식,3647
19,하우스하이드청주점,충북 청주시 흥덕구 신성로 11-0,카페/찻집,3612
20,위드쿠잉,충북 청주시 흥덕구 동촌로28번길 28-0,외국식,3465
21,상무초밥청주점,충북 청주시 흥덕구 대농로 49-0,외국식,3443
22,강남면옥,충북 청주시 흥덕구 가로수로 1367-0,한식,3263
23,버거킹청주예술의전당오일뱅크DT점,충북 청주시 흥덕구 직지대로 677-0,간이음식,3247
24,다낭,충북 청주시 흥덕구 오송생명3로 65-22,외국식,3127
25,수이재1928,충북 청주시 흥덕구 강서로71번길 4-0,한식,3121
26,대운분식,충북 청주시 흥덕구 청주역로 654-0,간이음식,3073
27,아키아키[일식],충북 청주시 흥덕구 1순환로 528-0,외국식,3054
28,군산활어도매시장,충북 청주시 흥덕구 덕암로30번길 38-0,외국식,3026
29,상춘고택[한식],충북 청주시 흥덕구 소로1길 62-13,한식,2993
30,백로식당본점,충북 청주시 흥덕구 1순환로 418-0,한식,2926
31,쭈낙해물칼국수,충북 청주시 흥덕구 덕암로41번길 83-0,한식,2897
32,아르떼물들이다,충북 청주시 흥덕구 원평로10번길 132-0,카페/찻집,2893
33,페트라,충북 청주시 흥덕구 2순환로 626-0,카페/찻집,2871
34,비파해물칼국수,충북 청주시 흥덕구 송화로108번길 32-0,한식,2851
35,원산냉면,충북 청주시 흥덕구 직지대로 611-0,한식,2733
36,본가장수촌청주가경점,충북 청주시 흥덕구 2순환로1340번길 9-0,한식,2722
37,우림칼국수본점,충북 청주시 흥덕구 쌍청2길 5-0,한식,2680
38,용만두전골,충북 청주시 흥덕구 청주역로 637-0,한식,2581
39,정다운샤브막국수복대본점,충북 청주시 흥덕구 죽천로 96-2,외국식,2550
40,애슐리NC청주점,충북 청주시 흥덕구 2순환로 1233-0,외국식,2531
41,칠성반점[중식],충북 청주시 흥덕구 가로수로1154번길 22-1,외국식,2484
42,아치오,충북 청주시 흥덕구 서부로1168번길 23-0,카페/찻집,2473
43,포비청주점,충북 청주시 흥덕구 서현로 68-0,카페/찻집,2420
44,투썸플레이스청주예술의전당DT점,충북 청주시 흥덕구 직지대로 680-0,카페/찻집,2387
45,산청꿀갈비,충북 청주시 흥덕구 2순환로 1124-0,한식,2380
46,동림가든,충북 청주시 흥덕구 심동로 655-0,한식,2338
47,오성당,충북 청주시 흥덕구 풍산로 55-0,간이음식,2243
48,전통꽃게장,충북 청주시 흥덕구 주현로41번길 19-0,외국식,2213
49,대명도리탕,충북 청주시 흥덕구 백봉로 188-1,외국식,2191
50,파스쿠찌청주시실리점,충북 청주시 흥덕구 가로수로 480-0,카페/찻집,2151
51,산하춘[한식],충북 청주시 흥덕구 월탄1길 15-11,한식,2122
52,컴포트커피,충북 청주시 흥덕구 직지대로753번길 36-0,카페/찻집,2121
53,스타벅스청주강서점,충북 청주시 흥덕구 강서로 121-0,카페/찻집,2102
54,프롬썬,충북 청주시 흥덕구 중부로 298-0,카페/찻집,2099
55,진성식당,충북 청주시 흥덕구 엘지로 29-0,한식,2070
56,민속촌소머리국밥,충북 청주시 흥덕구 미호천길 5-0,한식,2021
57,도성[한식],충북 청주시 흥덕구 가로수로 1169-0,한식,1973
58,스타벅스청주지웰시티점,충북 청주시 흥덕구 대농로 17-0,카페/찻집,1968
59,옥산해장국집,충북 청주시 흥덕구 청주역로 670-0,한식,1961
60,할리스충북오송점,충북 청주시 흥덕구 만수1길 3-0,카페/찻집,1933
61,투썸플레이스청주비하점,충북 청주시 흥덕구 2순환로 1112-0,카페/찻집,1900
62,촌골,충북 청주시 흥덕구 짐대로 53-0,한식,1885
63,풀문강서점,충북 청주시 흥덕구 강서로27번길 9-6,카페/찻집,1873
64,투썸플레이스가경파크점,충북 청주시 흥덕구 서현로 90-0,카페/찻집,1871
65,아도르,충북 청주시 흥덕구 월탄2길 65-24,카페/찻집,1849
66,삿뽀로청주점,충북 청주시 흥덕구 2순환로 1250-0,외국식,1821
67,나릿집,충북 청주시 흥덕구 덕암로30번길 18-0,한식,1781
68,용자1,충북 청주시 흥덕구 죽천로 96-19,한식,1772
69,까망염소,충북 청주시 흥덕구 고락로40번길 19-0,한식,1761
70,타임스테이,충북 청주시 흥덕구 서부로1168번길 31-35,카페/찻집,1758
71,스타벅스청주터미널점,충북 청주시 흥덕구 풍산로 15-0,카페/찻집,1753
72,리트리빈,충북 청주시 흥덕구 청정로 14-0,카페/찻집,1734
73,로우업커피스탠드,충북 청주시 흥덕구 월명로48번길 31-0,카페/찻집,1689
74,백송짜글짜글2호점,충북 청주시 흥덕구 옥산시내1길 63-0,한식,1628
75,믹스레스토랑,충북 청주시 흥덕구 경산로43번길 12-0,외국식,1613
76,후마니타스,충북 청주시 흥덕구 주봉로15번길 25-0,카페/찻집,1603
77,한우만,충북 청주시 흥덕구 서부로1168번길 17-0,한식,1598
78,카페까망,충북 청주시 흥덕구 고락로40번길 25-0,카페/찻집,1596
79,사하라,충북 청주시 흥덕구 강서로 83-8,카페/찻집,1588
80,삼미원,충북 청주시 흥덕구 백봉로 178-0,한식,1544
81,명품순두부봉명점,충북 청주시 흥덕구 덕암로29번길 32-0,한식,1485
82,더멜,충북 청주시 흥덕구 주봉로15번길 11-0,카페/찻집,1482
83,플레이버인에스프레소,충북 청주시 흥덕구 가포산로 200-0,카페/찻집,1455
84,온센청주점,충북 청주시 흥덕구 대농로 33-0,외국식,1444
85,여기정,충북 청주시 흥덕구 직지대로 649-0,한식,1437
86,고향홍굴부추손칼국수본점,충북 청주시 흥덕구 직지대로581번길 122-0,한식,1398
87,나경한정식[한식],충북 청주시 흥덕구 월명로 172-0,한식,1396
88,레인디어커피,충북 청주시 흥덕구 가포산로 191-0,카페/찻집,1392
89,세컨디포레스트지웰시티점,충북 청주시 흥덕구 대농로 39-0,외국식,1389
89,짬뽕지존복대동지웰시티점 [중식],충북 청주시 흥덕구 진재로 115-0,외국식,1389
91,청주조개구이무한리필,충북 청주시 흥덕구 2순환로 1052-0,외국식,1356
92,대가한우,충북 청주시 흥덕구 직지대로 51-0,한식,1355
93,만타,충북 청주시 흥덕구 직지대로747번길 60-0,외국식,1336
94,강촌설렁탕,충북 청주시 흥덕구 1순환로 569-0,한식,1329
95,파스쿠찌서청주DT점,충북 청주시 흥덕구 2순환로 1067-2,카페/찻집,1321
96,장수오리,충북 청주시 흥덕구 서부로1168번길 23-8,외국식,1311
97,생선구이전문점정가네,충북 청주시 흥덕구 사운로 199-0,한식,1309
98,대왕아구찜해물찜,충북 청주시 흥덕구 죽천로89번길 18-0,한식,1283
99,맛찬들3.5왕소금구이복대점,충북 청주시 흥덕구 진재로 100-0,한식,1281
100,권가제면소오송점,충북 청주시 흥덕구 오송생명14로 363-0,외국식,1276
